{"bg_gradient_color_one":"pink","bg_gradient_color_two":"purple","font-size":20,"font-color":"white","font-family":"Arial, Helvetica, sans-serif","text-align":"middle","showTitle":"yes","showCurrentStrofaNumber":"no","padding-left":15,"padding-bottom":15,"css_content":"\n    html, body, div, span, applet, object, iframe,\nh1, h2, h3, h4, h5, h6, p, blockquote, pre,\na, abbr, acronym, address, big, cite, code,\ndel, dfn, em, font, img, ins, kbd, q, s, samp,\nsmall, strike, strong, sub, sup, tt, var,\ndl, dt, dd, ol, ul, li,\nfieldset, form, label, legend,\ntable, caption, tbody, tfoot, thead, tr, th, td {\n\tmargin: 0;\n\tpadding: 0;\n\tborder: 0;\n\toutline: 0;\n\tfont-weight: inherit;\n\tfont-style: inherit;\n\tfont-size: 100%;\n\tfont-family: inherit;}\n    \n    :root {\n        --gradient_color_one: pink;\n        --gradient_color_two: purple; \n        }\n    \n    .background_gradient{\n            position: fixed;\n            top: 0;\n            left: 0;\n            bottom: 0;\n            right: 0;\n            overflow: auto;\n            background: linear-gradient(to top right, var(--gradient_color_one) 0%, var(--gradient_color_two) 100%);\n    }\n    \n        .text-style-class{\n            font-family: Arial, Helvetica, sans-serif;\n            font-size: 20px;\n            color: white;\n        }\n    \n        .title-style-class{\n            font-family: Arial, Helvetica, sans-serif;\n            font-size: 30px;\n            color: white;\n            font-weight: bold;\n            display: ;\n        }\n\n        .verse-nb-class{\n            display: none;\n        }\n    \n        .align-content-middle{\n            display: flex;\n            flex-flow: column nowrap;\n            justify-content: center;\n            align-items: center;\n        }\n\n        .align-content-class{\n            padding-bottom: 15px;\n        }\n        "}